{
  "schemaVersion": 2,
  "id": "c4b445d87e350297",
  "world": {
    "schemaVersion": 2,
    "pack": "stavanger-1989",
    "fabric": {
      "year": 1989,
      "month": 10
    },
    "dayOfYear": 293,
    "timeOfDayS": 46800,
    "instantMs": 0,
    "weather": {
      "cover": 970,
      "precipitation": "drizzle",
      "intensity": 300,
      "surfacesWet": 850,
      "haze": 600,
      "cloudKind": "stratus"
    },
    "wind": {
      "climate": {
        "fromMillidegrees": 200000,
        "speedMmPerS": 5000
      },
      "moving": {
        "fromMillidegrees": 230000,
        "speedMmPerS": 3000,
        "gust": 200
      },
      "fetchMm": 20000000
    },
    "tideMm": 500,
    "latitudeMicrodeg": 58970000,
    "longitudeMicrodeg": 5730000,
    "utcOffsetMinutes": 60
  },
  "sources": {
    "fabric": "0aa0e2aad9c305fa",
    "people": "30587acb1cd5fd00",
    "pack": "9de3252d43e0b7f9",
    "keys": "8811b15a45394873",
    "function": "light-derive-3"
  },
  "overrides": [],
  "derived": {
      "sun": {
          "azimuthMillidegrees": 189996,
          "elevationMillidegrees": 20214,
          "illuminanceLux": 36231.75,
          "rgb": [
              1.326852798461914,
              0.9447788000106812,
              0.5845617651939392
          ]
      },
      "sky": {
          "model": "single-scatter-1",
          "params": {
              "turbidity": 0.33000001311302185,
              "overcast": 0.9700000286102295,
              "groundAlbedo": [
                  0.16189347207546234,
                  0.13479462265968323,
                  0.1270959973335266
              ]
          },
          "sh": [
              4376.49365234375,
              4317.23193359375,
              4300.6435546875,
              4257.21728515625,
              4226.02734375,
              4238.34375,
              0.03410554677248001,
              0.028483698144555092,
              0.022805986925959587,
              490.2481994628906,
              409.8313903808594,
              326.9228210449219,
              373.8003234863281,
              323.06768798828125,
              270.36761474609375,
              0.026028696447610855,
              0.022433239966630936,
              0.018805451691150665,
              -795.8866577148438,
              -755.8963012695313,
              -719.7865600585938,
              0.0571453683078289,
              0.047648198902606964,
              0.03782329708337784,
              -555.6727905273438,
              -622.8421630859375,
              -701.1366577148438
          ],
          "illuminanceLux": 8664.595703125,
          "dome": {
              "zenith": [
                  1911.2904052734375,
                  2185.96875,
                  3165.06494140625
              ],
              "horizon": [
                  1331.8365478515625,
                  1310.563720703125,
                  1299.0040283203125
              ],
              "towardSun": [
                  2745.957275390625,
                  2375.05419921875,
                  2031.7750244140625
              ],
              "awayFromSun": [
                  1404.3387451171875,
                  1390.41064453125,
                  1385.7420654296875
              ],
              "deck": [
                  3392.696533203125,
                  3376.24560546875,
                  3369.547607421875
              ]
          }
      },
      "air": {
          "phaseG": 0.7599999904632568,
          "layers": [
              {
                  "toMm": 220000,
                  "density": 0.006013505160808563,
                  "rgb": [
                      2485.294921875,
                      2445.598388671875,
                      2424.02734375
                  ]
              },
              {
                  "toMm": 1500000,
                  "density": 0.006013505160808563,
                  "rgb": [
                      2485.294921875,
                      2445.598388671875,
                      2424.02734375
                  ]
              },
              {
                  "toMm": 1500000,
                  "density": 0.0032225577160716057,
                  "rgb": [
                      2485.294921875,
                      2445.598388671875,
                      2424.02734375
                  ]
              }
          ]
      },
      "keys": {
          "elevationMillidegrees": 20214,
          "evening": 0.5838508605957031,
          "weather": {
              "clear": 0.0,
              "overcast": 1.0,
              "fog": 0.0
          },
          "pushes": [
              {
                  "target": "air",
                  "dL": 0.0,
                  "dC": 0.0,
                  "dh": 0.0,
                  "dLog2": 0.8999999761581421,
                  "add": 0.0
              },
              {
                  "target": "grade.temperature",
                  "dL": 0.0,
                  "dC": 0.0,
                  "dh": 0.0,
                  "dLog2": 0.0,
                  "add": -16.0
              }
          ]
      },
      "circuitsOn": [],
      "exposureEv100": 11.895710945129395,
      "maps": [
          {
              "id": "height-sky",
              "inputs": "48c6db8dfdd7c873"
          },
          {
              "id": "cloud",
              "inputs": "f03b48e7e715a4d2"
          }
      ]
  }
}
