{
  "schemaVersion": 2,
  "id": "25e5c034f489a669",
  "world": {
    "schemaVersion": 2,
    "pack": "stavanger-1989",
    "fabric": {
      "year": 1989,
      "month": 10
    },
    "dayOfYear": 293,
    "timeOfDayS": 34200,
    "instantMs": 0,
    "weather": {
      "cover": 200,
      "precipitation": "none",
      "intensity": 0,
      "surfacesWet": 100,
      "haze": 450,
      "cloudKind": "cumulus",
      "highCover": 250
    },
    "wind": {
      "climate": {
        "fromMillidegrees": 200000,
        "speedMmPerS": 5000
      },
      "moving": {
        "fromMillidegrees": 90000,
        "speedMmPerS": 2000,
        "gust": 200
      },
      "fetchMm": 20000000
    },
    "tideMm": 500,
    "latitudeMicrodeg": 58970000,
    "longitudeMicrodeg": 5730000,
    "utcOffsetMinutes": 60
  },
  "sources": {
    "fabric": "0aa0e2aad9c305fa",
    "people": "30587acb1cd5fd00",
    "pack": "a9c535b7daf10c97",
    "keys": "5c0f0cc4163ab6c8",
    "function": "light-derive-2"
  },
  "overrides": [],
  "derived": {
    "sun": {
      "azimuthMillidegrees": 136626,
      "elevationMillidegrees": 12583,
      "illuminanceLux": 23236.9453125,
      "rgb": [
        1.4389195442199707,
        0.9246170520782471,
        0.45428842306137085
      ]
    },
    "sky": {
      "model": "single-scatter-1",
      "params": {
        "turbidity": 0.26249998807907104,
        "overcast": 0.20000000298023224,
        "groundAlbedo": [
          0.16189347207546234,
          0.13479462265968323,
          0.1270959973335266
        ]
      },
      "sh": [
        8643.328125,
        7496.47998046875,
        6986.884765625,
        5453.974609375,
        5126.08056640625,
        5466.228515625,
        5545.46533203125,
        3917.848876953125,
        2255.0400390625,
        4123.59423828125,
        2913.29052734375,
        1676.8109130859375,
        2272.57958984375,
        1680.2637939453125,
        1053.932861328125,
        3056.385498046875,
        2259.8056640625,
        1417.4794921875,
        3463.869140625,
        2437.494140625,
        1296.9681396484375,
        5940.73388671875,
        4226.064453125,
        2476.065673828125,
        2428.93798828125,
        1681.730712890625,
        758.0111694335938
      ],
      "illuminanceLux": 10684.232421875,
      "dome": {
        "zenith": [
          1142.5150146484375,
          1364.10546875,
          2044.1002197265625
        ],
        "horizon": [
          2666.90771484375,
          2268.89990234375,
          1982.725830078125
        ],
        "towardSun": [
          49794.25,
          32043.3046875,
          15919.625
        ],
        "awayFromSun": [
          2739.603271484375,
          2525.359130859375,
          2341.25537109375
        ],
        "deck": [
          6279.09228515625,
          5591.71240234375,
          5412.4677734375
        ]
      }
    },
    "air": {
      "phaseG": 0.7599999904632568,
      "layers": [
        {
          "toMm": 220000,
          "density": 0.00023230774968396872,
          "rgb": [
            2666.90771484375,
            2268.89990234375,
            1982.725830078125
          ]
        },
        {
          "toMm": 1500000,
          "density": 0.00023230774968396872,
          "rgb": [
            2666.90771484375,
            2268.89990234375,
            1982.725830078125
          ]
        },
        {
          "toMm": 1500000,
          "density": 0.00023230774968396872,
          "rgb": [
            2666.90771484375,
            2268.89990234375,
            1982.725830078125
          ]
        }
      ]
    },
    "keys": {
      "elevationMillidegrees": 12583,
      "evening": 0.15998631715774536,
      "weather": {
        "clear": 1.0,
        "overcast": 0.0,
        "fog": 0.0
      },
      "pushes": []
    },
    "circuitsOn": [],
    "exposureEv100": 12.530869483947754,
    "maps": [
      {
        "id": "height-sky",
        "inputs": "48c6db8dfdd7c873"
      },
      {
        "id": "cloud",
        "inputs": "9c73196fed0104a8"
      }
    ]
  }
}
